functions	ids	num_ids	picrust_pa	pi_prop	dram_pa	dr_prop
Polyphenolics	K05909, AA1, AA2, K00422	4	0	0	0	0
Crystalline Cellulose	GH7, GH48, AA10, AA15, AA16, AA9, AA11, AA13	9	2	22.22222222222222	0	0
Amorphous Cellulose	GH5, GH6, GH7, GH8, GH9, GH10, GH124, GH12, GH44, GH45, GH94, GH1, GH2, GH3, GH16, GH116	18	14	77.77777777777779	7	38.88888888888889
Mucin	GH101, GH27, GH129, GH112, GH109, GH31, GH36	7	4	57.14285714285714	4	57.14285714285714
Sulf-Polysachharides	GH111, GH16, GH82, GH150, GH79, PL29, PL30, PL33, PL8, PL12, PL13, PL15, PL21, PL6, PL37, GH56, GH86, PL23, PL24, PL25, GH88, GH117	26	0	0	1	3.8461538461538463
Xyloglucan	GH5, GH9, GH12, GH16, GH44, GH45, GH48, GH74, AA9, GH31, GH43, GH10, GH2	13	10	76.92307692307693	5	38.46153846153847
Starch	AA13, GH13, GH14, GH57, GH119, GH126, GH133, GH15, GH97	9	5	55.55555555555556	3	33.33333333333333
Chitin	GH18, GH19, GH23, GH73, GH20, GH3, GH5, GH84, GH116, AA10, AA11, AA15, CE4	13	5	38.46153846153847	7	53.84615384615385
Pectin	GH28, PL1, PL2, PL9, PL10, PL11, PL22, PL26, PL3, PL4, GH78, GH106, GH138, GH139, GH143, CE8, GH105, GH4, CE12, GH2	20	5	25	9	45
Alpha-galactans	GH166, GH27, GH110, GH4, GH31, GH36, GH97	7	6	85.71428571428571	6	85.71428571428571
Beta-galactan (pectic galactan)	GH53, GH2, GH35, GH42, GH1, GH59, GH147, GH165	8	7	87.5	3	37.5
Mixed-Linkage glucans	GH16, GH30, GH17, GH7, GH8, GH9, GH5, GH55, GH64, GH81, GH128, GH152, GH157, GH158, GH3, GH1	19	6	31.57894736842105	5	26.31578947368421
Xylans	GH10, GH26, GH8, GH5, GH11, GH30, GH98, GH141, GH39, GH3, GH31, GH52, GH120, GH115, GH67	15	6	40	5	33.33333333333333
Beta-mannan	GH113, GH134, GH26, GH5, GH130, CE2, CE17, GH2	10	2	20	3	30
Alpha-mannan	GH99, GH76, GH92, GH38, GH63, GH47, GH125, GH130	9	2	22.22222222222222	2	22.22222222222222
Arabinan	GH43, GH49, GH93, GH51, GH3, GH54, GH62	8	2	25	3	37.5
Rhamnose cleavage	GH78, GH106, GH145, PL24, PL25, PL27, PL28, GH28	8	3	37.5	2	25
Fucose Cleavage	GH107, GH139, GH141, GH151, GH29, GH95	6	4	66.66666666666666	2	33.33333333333333
Arabinose cleavage	GH121, GH127, GH137, GH142, GH146, GH54, GH62, GH2	8	1	12.5	2	25
XyloseDegradation	K14275, K14274, K14273, K00078, K17743, K05351, K00854, K00011, K00008, K01805	10	2	20	6	60
SucroseDegradation	K15922, K12317, K12316, K12047, K01203, K01193, K01187, K00690	8	2	25	2	25
NonSpecificHexoseSugar	K00844	1	0	0	1	100
MannoseDegradation	K02796, K02795, K02794, K02793, K01809	5	5	100	0	0
LactoseDegradation	K12309, K12112, K12111, K01190	4	1	25	1	25
GalacturonicAcidDegradation	K16850, K16849, K01685, K01625, K00874, K00041	6	2	33.33333333333333	3	50
GalactoseDegradation	K01785, K01784, K00965, K00849	4	4	100	4	100
FucoseDegradation	K01818, K01628, K00879	3	2	66.66666666666666	2	66.66666666666666
FructoseDegradation	K00847	1	1	100	1	100
Propionate	K19697, K01026	2	1	50	0	0
Butyrate	K00634, K00929	2	2	100	0	0
Acetate	K01896, K01067, K01905	3	0	0	0	0
Lactate	K00101, K03777	2	0	0	0	0
Non-SpecificAlcohols	K00121, K04072, K13951, K13952, K13953, K13980, K18857	7	1	14.285714285714285	0	0
SulfateReduction	K11180, K11181, K00380, K00381, K00392, EC1.8.99.5, EC1.8.1.2, EC1.8.7.1	8	0	0	0	0
FumarateReduction	K00244, K00245, K00246, K00247	4	1	25	1	25
Aerobic	K02275, K02274, K02276, K15408, K02277, K02827, K02826, K02828, K02829, K02297, K02298, K02299, K02300, K00330, K00331, K00332, K00333, K13378, K13380, K00334, K00335, K00336, K00337, K00338, K00339, K00340, K00341, K00342, K15863, K00343, K05574, K05582, K05581, K05579, K05572, K05580, K05578, K05576, K05577, K05575, K05573, K05583, K05584, K05585, K03945, K03946, K03947, K03948, K03949, K03950, K03951, K03952, K03953, K03954, K03955, K03956, K11352, K11353	58	13	22.413793103448278	7	12.068965517241379
TetrathionateReduction	K13040, K13041, K08359, K08358, K08357	5	0	0	0	0
Microaerophillic	K00425, K00426, K00424, K22501, K00404, K00405, K15862, K00407, K00406, K00330, K00331, K00332, K00333, K13378, K13380, K00334, K00335, K00336, K00337, K00338, K00339, K00340, K00341, K00342, K15863, K00343, K05574, K05582, K05581, K05579, K05572, K05580, K05578, K05576, K05577, K05575, K05573, K05583, K05584, K05585, K03945, K03946, K03947, K03948, K03949, K03950, K03951, K03952, K03953, K03954, K03955, K03956, K11352, K11353	54	15	27.77777777777778	6	11.11111111111111
DenitrificationNotETC	K00370, K00371, K00374, K02567, K02568, K00368, K15864, K04561, K02305, K00376, EC1.7.5.1, EC1.9.6.1, EC1.7.2.1, EC1.7.2.5, EC1.7.2.4	15	0	0	2	13.333333333333334
TMAO	K07811	1	0	0	0	0
